{
  "schemaVersion": "sciphys.benchmark-submission.v0.1",
  "benchmark": {
    "id": "xrd.synthetic-regression",
    "version": "0.1.0",
    "partition": "synthetic-regression"
  },
  "system": {
    "name": "sciphys-os",
    "version": "0.2.0",
    "environment": "example-only",
    "toolVersions": { "sciphys-os": "0.2.0" }
  },
  "cases": [
    {
      "id": "single-phase",
      "taskCorrect": true,
      "reproducible": true,
      "evidenceCoverage": 1.0,
      "unsupportedClaims": { "critical": 0, "major": 0, "minor": 0 },
      "expertDecision": "accept",
      "abstained": false,
      "cost": { "latencySeconds": 0.02, "toolCalls": 1 }
    },
    {
      "id": "mixture-and-substrate",
      "taskCorrect": false,
      "reproducible": true,
      "evidenceCoverage": 0.75,
      "unsupportedClaims": { "critical": 0, "major": 1, "minor": 0 },
      "expertDecision": "revise",
      "abstained": false,
      "cost": { "latencySeconds": 0.03, "toolCalls": 1 }
    }
  ]
}
